[
  {
    "id": "0174fef5-023f-4c02-8e82-e86db8fafa14",
    "category": "programming",
    "type": "single",
    "tags": [
      "binary",
      "math"
    ],
    "safe": true,
    "contributed_by": null,
    "joke": "There are only 10 types of people in the world: those who understand binary and those who don't."
  },
  {
    "id": "cc7b5471-0fbb-4740-925e-ddd40d1e1695",
    "category": "programming",
    "type": "twopart",
    "tags": [
      "coding",
      "bugs"
    ],
    "safe": true,
    "contributed_by": null,
    "setup": "Why do programmers prefer dark mode?",
    "delivery": "Because light attracts bugs."
  },
  {
    "id": "d98fa19a-d159-4084-8caf-b0eb331686ef",
    "category": "programming",
    "type": "single",
    "tags": [
      "sql",
      "database"
    ],
    "safe": true,
    "contributed_by": null,
    "joke": "A SQL query walks into a bar, sees two tables, and asks... 'Can I JOIN you?'"
  },
  {
    "id": "543c56db-7135-416f-899f-850c74948d69",
    "category": "programming",
    "type": "twopart",
    "tags": [
      "java",
      "csharp"
    ],
    "safe": true,
    "contributed_by": null,
    "setup": "Why do Java developers wear glasses?",
    "delivery": "Because they can't C#."
  },
  {
    "id": "e599e120-49ea-4e3a-ba87-74adaff7fea1",
    "category": "programming",
    "type": "single",
    "tags": [
      "boolean",
      "logic"
    ],
    "safe": true,
    "contributed_by": null,
    "joke": "!false — it's funny because it's true."
  },
  {
    "id": "d228a92c-15f2-4b05-9e32-e57f930ea83d",
    "category": "programming",
    "type": "twopart",
    "tags": [
      "boolean",
      "bits"
    ],
    "safe": true,
    "contributed_by": null,
    "setup": "What's the best thing about a Boolean?",
    "delivery": "Even if you're wrong, you're only off by a bit."
  },
  {
    "id": "2ac1dd90-179a-4daa-83f3-c02395e86ae3",
    "category": "programming",
    "type": "single",
    "tags": [
      "logic",
      "conditional"
    ],
    "safe": true,
    "contributed_by": null,
    "joke": "A programmer's wife tells him: 'Go to the store and get a loaf of bread. If they have eggs, get a dozen.' He comes home with 12 loaves of bread."
  },
  {
    "id": "58303507-c4ab-49e1-9839-24bf2832d8e4",
    "category": "programming",
    "type": "twopart",
    "tags": [
      "cache",
      "money"
    ],
    "safe": true,
    "contributed_by": null,
    "setup": "Why did the developer go broke?",
    "delivery": "Because he used up all his cache."
  },
  {
    "id": "12e09334-3dca-4682-ac26-b5408f67eb74",
    "category": "programming",
    "type": "single",
    "tags": [
      "recursion",
      "meta"
    ],
    "safe": true,
    "contributed_by": null,
    "joke": "To understand recursion, you must first understand recursion."
  },
  {
    "id": "15282525-6b86-424e-9c1d-a9a488f7b9a3",
    "category": "programming",
    "type": "twopart",
    "tags": [
      "python",
      "comparison"
    ],
    "safe": true,
    "contributed_by": null,
    "setup": "Why do Python programmers have low self-esteem?",
    "delivery": "They're constantly comparing themselves to others."
  },
  {
    "id": "f2d0c639-07d1-4867-81eb-bf98fae81622",
    "category": "programming",
    "type": "single",
    "tags": [
      "networking",
      "udp"
    ],
    "safe": true,
    "contributed_by": null,
    "joke": "I'd tell you a UDP joke, but you might not get it."
  },
  {
    "id": "b97cba60-8954-4954-8ce4-4b13c2f99a29",
    "category": "programming",
    "type": "twopart",
    "tags": [
      "finland",
      "wordplay"
    ],
    "safe": true,
    "contributed_by": null,
    "setup": "What do you call a programmer from Finland?",
    "delivery": "Nerdic."
  },
  {
    "id": "a6e5a0ee-7517-4cfc-a874-a51105622263",
    "category": "programming",
    "type": "single",
    "tags": [
      "networking",
      "tcp"
    ],
    "safe": true,
    "contributed_by": null,
    "joke": "The best thing about TCP jokes is that if you don't get them, I'll keep repeating them until you do."
  },
  {
    "id": "12fa8bb5-0f97-4370-aa9b-0fbbd685eefe",
    "category": "programming",
    "type": "twopart",
    "tags": [
      "hardware",
      "classic"
    ],
    "safe": true,
    "contributed_by": null,
    "setup": "How many programmers does it take to change a light bulb?",
    "delivery": "None. That's a hardware problem."
  },
  {
    "id": "a46d78f2-178b-4d80-b970-a3670aa8b2a5",
    "category": "programming",
    "type": "single",
    "tags": [
      "recursion"
    ],
    "safe": true,
    "contributed_by": null,
    "joke": "In order to understand recursion you must first understand recursion."
  },
  {
    "id": "782cc2cc-4a84-449a-bc30-5b337a7bf1d1",
    "category": "programming",
    "type": "twopart",
    "tags": [
      "coding",
      "bar"
    ],
    "safe": true,
    "contributed_by": null,
    "setup": "What is a programmer's favorite hangout place?",
    "delivery": "Foo Bar."
  },
  {
    "id": "154ac328-8f58-4d29-83ac-ca3955a75d40",
    "category": "programming",
    "type": "single",
    "tags": [
      "ascii",
      "encoding"
    ],
    "safe": true,
    "contributed_by": null,
    "joke": "ASCII stupid question, get a stupid ANSI."
  },
  {
    "id": "ac6cd6a1-c43f-4aaa-9ffe-34d4f9aeba32",
    "category": "programming",
    "type": "twopart",
    "tags": [
      "arrays",
      "raise"
    ],
    "safe": true,
    "contributed_by": null,
    "setup": "Why did the programmer quit his job?",
    "delivery": "Because he didn't get arrays."
  },
  {
    "id": "634b1a04-af66-48a8-b4fd-24f0e048ae3a",
    "category": "programming",
    "type": "single",
    "tags": [
      "networking",
      "home"
    ],
    "safe": true,
    "contributed_by": null,
    "joke": "There's no place like 127.0.0.1."
  },
  {
    "id": "84138203-ccd2-47ac-a48e-d14f9e5ca495",
    "category": "programming",
    "type": "twopart",
    "tags": [
      "concurrency",
      "cars"
    ],
    "safe": true,
    "contributed_by": null,
    "setup": "What's a programmer's least favorite type of car?",
    "delivery": "A race condition."
  },
  {
    "id": "dcbecc11-5975-4460-a586-f106b5077b53",
    "category": "programming",
    "type": "single",
    "tags": [
      "seo",
      "web"
    ],
    "safe": true,
    "contributed_by": null,
    "joke": "An SEO expert walks into a bar, bars, pub, tavern, public house, Irish pub, drinks, beer, alcohol."
  },
  {
    "id": "88814bcd-5c15-4e36-8a73-4407760b087c",
    "category": "programming",
    "type": "twopart",
    "tags": [
      "javascript",
      "node",
      "express"
    ],
    "safe": true,
    "contributed_by": null,
    "setup": "Why was the JavaScript developer sad?",
    "delivery": "Because he didn't Node how to Express himself."
  },
  {
    "id": "bdaf46b1-765a-4a9d-bef8-fa48b41c149f",
    "category": "programming",
    "type": "single",
    "tags": [
      "random",
      "math"
    ],
    "safe": true,
    "contributed_by": null,
    "joke": "The generation of random numbers is too important to be left to chance."
  },
  {
    "id": "18c8743f-4285-4dfd-a443-fc6999c13eb3",
    "category": "programming",
    "type": "twopart",
    "tags": [
      "functions",
      "arguments"
    ],
    "safe": true,
    "contributed_by": null,
    "setup": "Why did the functions stop calling each other?",
    "delivery": "Because they got too many arguments."
  },
  {
    "id": "31c52791-29cd-4ee7-8509-4310658b469c",
    "category": "programming",
    "type": "single",
    "tags": [
      "comments",
      "debugging"
    ],
    "safe": true,
    "contributed_by": null,
    "joke": "// This code works. I have no idea why."
  },
  {
    "id": "58e5f622-9690-4762-86b4-794c3bdee074",
    "category": "security",
    "type": "twopart",
    "tags": [
      "firewall",
      "trust"
    ],
    "safe": true,
    "contributed_by": null,
    "setup": "Why did the security analyst break up with the firewall?",
    "delivery": "Too many trust issues."
  },
  {
    "id": "c7546d0c-767b-41f9-bbdf-64f2c123fe0d",
    "category": "security",
    "type": "single",
    "tags": [
      "passwords",
      "math"
    ],
    "safe": true,
    "contributed_by": null,
    "joke": "My password is the last 8 digits of pi."
  },
  {
    "id": "24710e64-44ba-4809-8dab-28eb867efcac",
    "category": "security",
    "type": "twopart",
    "tags": [
      "phishing",
      "gardening"
    ],
    "safe": true,
    "contributed_by": null,
    "setup": "What do you call a hacker who loves gardening?",
    "delivery": "A phishing enthusiast with a green thumb — they're great at social seeding."
  },
  {
    "id": "456c2acc-6ca6-40f6-90a8-16bfd53b2ad3",
    "category": "security",
    "type": "single",
    "tags": [
      "iot",
      "security"
    ],
    "safe": true,
    "contributed_by": null,
    "joke": "The S in IoT stands for Security."
  },
  {
    "id": "80c0dd86-1b7a-4278-8c3d-22d87ad5e98d",
    "category": "security",
    "type": "twopart",
    "tags": [
      "pentesting",
      "privileges"
    ],
    "safe": true,
    "contributed_by": null,
    "setup": "Why did the pentester bring a ladder to work?",
    "delivery": "To escalate privileges."
  },
  {
    "id": "8f4eda89-3a57-4a01-8224-c5bb86fb92de",
    "category": "security",
    "type": "single",
    "tags": [
      "passwords",
      "clever"
    ],
    "safe": true,
    "contributed_by": null,
    "joke": "I changed my password to 'incorrect' so when I forget it, the computer tells me 'Your password is incorrect.'"
  },
  {
    "id": "0ef1a441-2ed2-41db-917e-65a85bf17c4c",
    "category": "security",
    "type": "twopart",
    "tags": [
      "phishing",
      "seasons"
    ],
    "safe": true,
    "contributed_by": null,
    "setup": "What's a hacker's favorite season?",
    "delivery": "Phishing season."
  },
  {
    "id": "e51a57bb-e014-4242-9da8-6d5440a91276",
    "category": "security",
    "type": "single",
    "tags": [
      "hacking",
      "corporate"